{
  "case_id": "generic_title__book_reviews",
  "case_type": "GENERIC_TITLE_NO_METADATA",
  "severity": 2,
  "status": "open",
  "summary": "Generic title 'Book Reviews' appears 22 times across different journals - short titles inflate Jaccard scores and cause unrelated journal sections to be flagged as duplicates",

  "records": {
    "journal_a": {
      "source": "crossref",
      "source_key": "10.1111/example-a",
      "title": "Book Reviews",
      "year": 2023,
      "doi_raw": "10.1111/example-a",
      "authors": [],
      "container": {
        "name": "Journal of History",
        "volume": "45",
        "issue": "3"
      },
      "provenance": {
        "ingest_batch": "2026-01-12-crossref-100k"
      }
    },
    "journal_b": {
      "source": "crossref",
      "source_key": "10.1080/example-b",
      "title": "Book Reviews",
      "year": 2023,
      "doi_raw": "10.1080/example-b",
      "authors": [],
      "container": {
        "name": "Political Science Quarterly",
        "volume": "138",
        "issue": "2"
      },
      "provenance": {
        "ingest_batch": "2026-01-12-crossref-100k"
      }
    }
  },

  "expected_relation": "NOT_DUPLICATE",
  "observed_relation": "DUPLICATE",

  "signals": {
    "es_score": 45.0,
    "title_jaccard": 1.0,
    "author_count_incoming": 0,
    "author_count_candidate": 0,
    "year_delta": 0,
    "doi_equal": false
  },

  "decision_trace": {
    "confidence": "MEDIUM"
  },

  "mitigations": [
    "generic_title_blocklist",
    "short_title_additional_metadata_required"
  ],

  "notes": "Classic generic title collision. Title is 2 tokens, Jaccard is 1.0. These are valid Crossref DOIs for journal back matter sections. Different publishers, different journals, same year, same generic title. Other examples from dataset: 'Editorial Board' (14 instances), 'Preface' (12), 'Announcements' (10), 'Frontmatter' (14), 'Issue Information' (6). Current system correctly marked as MEDIUM confidence (not HIGH), but should probably be UNSEARCHABLE or require journal+volume+issue match for deduplication."
}
